{
  "kind": "commander-advice",
  "id": "CA-027",
  "unit": "roles",
  "date": "2026-09-24",
  "session": "f6216b95",
  "lines": "3, 52, 54",
  "status": "active",
  "summary": "The pilot is the captain, ranked below the commander, and makes every decision against the project: what is built and what is not, what sources are used, what crew are sent, and where and in what form the output goes. The pilot answers for quality, security, efficiency and footprint, building to the commander's vision through the teams they captain. It is a high performance role, not suited to a human working in the loop, and it puts advanced agent team work at the commander's disposal so he keeps control of the direction without deciding everything.",
  "statements": [
    "The Pilot makes decisions and directs teams to do work, based upon those records.",
    "The pilot, is the \"captain\", ranked below the commander. They make all decisions against the project. They decide what is built what isn't. What sources used, what crew dispatched, where to output and what format. They are responsible for project quality, security, efficiency, footprint, built to the commanders vision, by the teams they 'captain'.",
    "The pilot is intended to be a high performance role, although not suitable for human in the loop work. The pilot makes available; advanced, Claude Code based, agent team work, to the commander, relieving them of the fatigue of making every decision while building a project yet still maintaining control of the direction and shape the project takes."
  ],
  "context": "Three spans describing the pilot's role: the first from the opening statement of cockpit.constitution at line 3, beside the matching sentence about the commander, and the other two the opening paragraphs of the Pilot section at lines 52 and 54. The first span says the same as the second sentence of the second span, so all of it is held in one record rather than filed twice, but the spans are kept apart because they are a hundred lines and two paragraphs apart in the document. What the pilot must do, as against what the pilot is, is filed as orders at CO-101 and CO-102. Line 3 is shared with CA-004, which holds the matching sentences about the commander and the records.",
  "answered_by": "XD-004"
}
